{
  "decisionBatchId": "77777777-7777-4777-8777-777777777777",
  "proposalBatchId": "55555555-5555-4555-8555-555555555555",
  "roomId": "22222222-2222-4222-8222-222222222222",
  "deviceId": "33333333-3333-4333-8333-333333333333",
  "schemaVersion": 1,
  "decidedByUserId": "44444444-4444-4444-8444-444444444444",
  "decidedAt": "2026-07-11T09:01:00Z",
  "decisions": [
    {
      "proposalId": "move:0123456789abcdef",
      "decision": "approved"
    },
    {
      "proposalId": "move:fedcba9876543210",
      "decision": "rejected",
      "reason": "Keep the existing image file."
    }
  ]
}
